{
  "$schema": "https://json-schema.org/draft/2020-12/schema",
  "title": "Broll Me palette v1",
  "type": "object",
  "additionalProperties": false,
  "required": [
    "schema_version",
    "id",
    "name",
    "colors"
  ],
  "properties": {
    "schema_version": {
      "const": 1
    },
    "id": {
      "type": "string",
      "pattern": "^[a-z0-9]+(?:-[a-z0-9]+)*$"
    },
    "name": {
      "type": "string",
      "minLength": 1
    },
    "colors": {
      "type": "object",
      "additionalProperties": false,
      "required": [
        "canvas",
        "surface",
        "surfaceAlt",
        "ink",
        "muted",
        "border",
        "accent",
        "accentDark",
        "onAccent",
        "inverseSurface",
        "inverseInk",
        "inverseMuted",
        "shadow"
      ],
      "properties": {
        "canvas": {
          "type": "string",
          "pattern": "^#[0-9a-fA-F]{6}$"
        },
        "surface": {
          "type": "string",
          "pattern": "^#[0-9a-fA-F]{6}$"
        },
        "surfaceAlt": {
          "type": "string",
          "pattern": "^#[0-9a-fA-F]{6}$"
        },
        "ink": {
          "type": "string",
          "pattern": "^#[0-9a-fA-F]{6}$"
        },
        "muted": {
          "type": "string",
          "pattern": "^#[0-9a-fA-F]{6}$"
        },
        "border": {
          "type": "string",
          "pattern": "^#[0-9a-fA-F]{6}$"
        },
        "accent": {
          "type": "string",
          "pattern": "^#[0-9a-fA-F]{6}$"
        },
        "accentDark": {
          "type": "string",
          "pattern": "^#[0-9a-fA-F]{6}$"
        },
        "onAccent": {
          "type": "string",
          "pattern": "^#[0-9a-fA-F]{6}$"
        },
        "inverseSurface": {
          "type": "string",
          "pattern": "^#[0-9a-fA-F]{6}$"
        },
        "inverseInk": {
          "type": "string",
          "pattern": "^#[0-9a-fA-F]{6}$"
        },
        "inverseMuted": {
          "type": "string",
          "pattern": "^#[0-9a-fA-F]{6}$"
        },
        "shadow": {
          "type": "string",
          "pattern": "^#[0-9a-fA-F]{6}$"
        },
        "rose": {
          "type": "string",
          "pattern": "^#[0-9a-fA-F]{6}$"
        },
        "coral": {
          "type": "string",
          "pattern": "^#[0-9a-fA-F]{6}$"
        },
        "honey": {
          "type": "string",
          "pattern": "^#[0-9a-fA-F]{6}$"
        }
      }
    }
  },
  "$comment": "Runtime palette.py additionally enforces text-pair contrast >=4.5:1; schema alone is insufficient."
}
